{
  "format_version": 1,
  "key_id": "connect-test-automations-2026-01",
  "payload_base64url": "eyJlbnRpdGxlbWVudF9pZCI6IjMzMzMzMzMzLTMzMzMtNDMzMy04MzMzLTMzMzMzMzMzMzMzMyIsImV4cGlyZXNfYXQiOiIyMDI3LTAxLTAxVDAwOjAwOjAwWiIsImZlYXR1cmVzIjpbImNvbm5lY3QuYXV0b21hdGlvbnMiXSwiZm9ybWF0X3ZlcnNpb24iOjEsImlzc3VlZF9hdCI6IjIwMjYtMDEtMDFUMDA6MDA6MDBaIiwibm90X2JlZm9yZSI6IjIwMjYtMDEtMDFUMDA6MDA6MDBaIiwic3ViamVjdCI6ImZpeHR1cmUtY3VzdG9tZXIifQ",
  "signature_base64url": "UsmtjgiREgSnqMScZxyLEUlhvFJ9aBjbEmYh8iDaflZWpWQXaWmS8EXO7jxQqma43t1bENeNK9weHY4RXZ45CQ"
}
